{
  "$schema": "https://json-schema.org/draft/2020-12/schema",
  "$id": "https://boe.example/mtt/shared-circle-morse-bott-rank-four.v1.schema.json",
  "title": "MTT shared-circle Morse-Bott radial action and rank-four determinant lift packet",
  "type": "object",
  "additionalProperties": false,
  "required": [
    "schema",
    "claim_id",
    "title",
    "date",
    "status",
    "source_provenance",
    "q79_carrier",
    "radial_source",
    "upper_action",
    "shared_circle_vacuum",
    "automorphism_transfer",
    "radial_projection",
    "determinant_lift",
    "pointed_intertwiner",
    "gate_ledger",
    "parameter_ledger",
    "physical_boundary",
    "frontier_delta",
    "checks",
    "check_summary"
  ],
  "properties": {
    "schema": {"const": "boe.mtt.shared-circle-morse-bott-rank-four.v1"},
    "claim_id": {"const": "CBF.T42"},
    "title": {"type": "string"},
    "date": {"type": "string"},
    "status": {"type": "string"},
    "source_provenance": {"type": "object"},
    "q79_carrier": {"type": "object"},
    "radial_source": {"type": "object"},
    "upper_action": {"type": "object"},
    "shared_circle_vacuum": {"type": "object"},
    "automorphism_transfer": {"type": "object"},
    "radial_projection": {"type": "object"},
    "determinant_lift": {"type": "object"},
    "pointed_intertwiner": {"type": "object"},
    "gate_ledger": {"type": "object"},
    "parameter_ledger": {"type": "object"},
    "physical_boundary": {"type": "object"},
    "frontier_delta": {"type": "string"},
    "checks": {"type": "object"},
    "check_summary": {"type": "object"}
  }
}
