{
  "automorphism_transfer": {
    "J_commutes_with_P": true,
    "J_commutes_with_Q": true,
    "J_is_skew": true,
    "J_squared_is_minus_identity": true,
    "action_depends_only_on_invariant_norms": true,
    "all_six_sheet_permutations_commute_with_J": true,
    "all_six_sheet_permutations_commute_with_P": true,
    "all_six_sheet_permutations_commute_with_Q": true,
    "group": "S3_sheet x U(1)_shared",
    "physical_parallel_Higgs_line_map_present": false,
    "shared_circle_action": "exp(theta J_DE)",
    "sheet_action": "rho(g)=diag(Pi_g,Pi_g)",
    "universal_shared_line_source_present": true
  },
  "check_summary": {
    "failed": [],
    "passed": 73,
    "total": 73
  },
  "checks": {
    "B_ACTION_open": true,
    "B_QFT_open": true,
    "Hessian_rank_five": true,
    "J_P_commutes": true,
    "J_Q_commutes": true,
    "J_skew": true,
    "J_source_match": true,
    "J_squared": true,
    "P_E_T_split": true,
    "P_Q_zero": true,
    "P_idempotent": true,
    "P_plus_Q": true,
    "P_source_match": true,
    "Q_idempotent": true,
    "Q_source_match": true,
    "S3_J_commutes": true,
    "S3_P_commutes": true,
    "S3_Q_commutes": true,
    "T41_gate_count_source": true,
    "a_cubic": true,
    "a_first_zero": true,
    "a_quartic": true,
    "a_quintic": true,
    "a_second_zero": true,
    "a_value_one": true,
    "constructed_root_hash": true,
    "finite_G0_closed": true,
    "finite_G1_closed": true,
    "finite_G2_closed": true,
    "full_remainder_emitted": true,
    "log_a_half_rho": true,
    "normalized_Hessian_formula": true,
    "operator_nonpromotion_guard": true,
    "packet_claim": true,
    "packet_count_unchanged": true,
    "packet_schema": true,
    "physical_G0_open": true,
    "physical_G1_open": true,
    "physical_G2_open": true,
    "physical_gate_count_zero": true,
    "physical_line_map_open": true,
    "q79_action_boundary_retained": true,
    "rank_E_one": true,
    "rank_P_two": true,
    "rank_Q_four": true,
    "rank_T_one": true,
    "rank_four_half_log": true,
    "rho_exact_jets": true,
    "rho_higher_nonzero": true,
    "rho_source_formula": true,
    "rho_zero_two_jet": true,
    "row_count_unchanged": true,
    "schema_closed": true,
    "schema_required": true,
    "shared_line_input": true,
    "source_01_hash_matches": true,
    "source_02_hash_matches": true,
    "source_03_hash_matches": true,
    "source_04_hash_matches": true,
    "source_05_hash_matches": true,
    "source_06_hash_matches": true,
    "source_lock_claim": true,
    "target_informed_guard": true,
    "theorem_action_formula": true,
    "theorem_full_pushforward": true,
    "theorem_operator_equation": true,
    "theorem_physical_counters": true,
    "theorem_shared_circle": true,
    "theorem_target_informed": true,
    "unique_alpha_four": true,
    "zero_fits": true,
    "zero_new_parameters": true,
    "zero_observed_inputs": true
  },
  "claim_id": "CBF.T42",
  "date": "2026-08-30",
  "determinant_lift": {
    "a_jets_at_x1_through_order5": [
      "1",
      "0",
      "0",
      "-8",
      "-32",
      "-24"
    ],
    "a_series_about_x1_through_order10": [
      "1",
      "0",
      "0",
      "-4/3",
      "-4/3",
      "-1/5",
      "83/90",
      "557/315",
      "2921/2520",
      "-989/5670",
      "-22607/18900"
    ],
    "determinant_equivalence_implies_operator_equivalence": false,
    "determinant_lift_is_target_informed": true,
    "effective_action": "Gamma_rel(h)=P_rel(h)+epsilon rho(h/H)",
    "first_nonconstant_a_coefficients": {
      "(x-1)^3": "-4/3",
      "(x-1)^4": "-4/3",
      "(x-1)^5": "-1/5"
    },
    "full_T39_remainder_emitted": true,
    "half_log_determinant": "(1/2)log det(K_Q(h)K_Q(H)^-1)=rho(h/H)",
    "isotropic_rank_m_unique_profile": "a_m(x)=exp(2rho(x)/m)",
    "log_a": "log a(x)=rho(x)/2",
    "log_a_series_about_x1_through_order10": [
      "0",
      "0",
      "0",
      "-4/3",
      "-4/3",
      "-1/5",
      "1/30",
      "-1/105",
      "1/280",
      "-1/630",
      "1/1260"
    ],
    "minimal_nonconstant_contact_order": 3,
    "normal_block": "K_Q(h)=kappa a(h/H) I_RanQ",
    "normalized_determinant_ratio": "det(K_Q(h)K_Q(H)^-1)=a(h/H)^4=exp(2rho(h/H))",
    "normalized_partition_ratio": "Z_Q(h)/Z_Q(H)=a(h/H)^(-2)=exp(-rho(h/H))",
    "rank": 4,
    "rank_four_profile_is_unique": true,
    "rho": "rho(x)=x^4(3/2-log(x^2))-2x^2+1/2",
    "rho_jets_at_x1_through_order5": [
      "0",
      "0",
      "0",
      "-16",
      "-64",
      "-48"
    ],
    "rho_series_about_x1_through_order10": [
      "0",
      "0",
      "0",
      "-8/3",
      "-8/3",
      "-2/5",
      "1/15",
      "-2/105",
      "1/140",
      "-1/315",
      "1/630"
    ]
  },
  "frontier_delta": "A single q79 P/Q/J action now realizes the shared-circle vacuum, the exact T38 radial restriction and pointed tangent square. The selected q79 normal rank four gives a unique isotropic determinant lift a=exp(rho/2), whose normalized finite BV/Gaussian pushforward emits the complete T39 anchored remainder. This closes a finite determinant-equivalent G0 model and reduces physical G0 to one explicit same-source normal-block determinant and operator intertwiner. Because the lift consumes rho, B.ACTION.01 and B.QFT.02 remain open.",
  "gate_ledger": {
    "G0_finite_determinant_equivalent_model": {
      "closed": true,
      "scope": "one constructed P/Q/J action, radial map and normalized rank-four pushforward"
    },
    "G0_selected_physical_source": {
      "closed": false,
      "missing": "derive K_phys and its determinant identity from the upstream q79/HYM action"
    },
    "G1_finite_Euclidean_tangent_isometry": {
      "closed": true,
      "scope": "declared finite Euclidean carrier metric only"
    },
    "G1_physical_tangent_pairing": {
      "closed": false,
      "missing": "parallel A35/q79 line map and physical wave-function metric"
    },
    "G2_finite_normalized_Gaussian_BV_pushforward": {
      "closed": true,
      "scope": "positive rank-four local Gaussian determinant model"
    },
    "G2_selected_interacting_state_BV": {
      "closed": false,
      "missing": "physical statistics, Lorentzian domain, state, QME pushforward and continuum limit"
    },
    "physical_gluing_gates_closed": 0,
    "physical_gluing_gates_total": 3,
    "physical_packets_accepted": 0,
    "physical_packets_total": 3,
    "physical_rows_accepted": 0,
    "physical_rows_total": 7
  },
  "parameter_ledger": {
    "candidate_coefficients_after_equal_stiffness": 0,
    "candidate_coefficients_before_equal_stiffness": 1,
    "determinant_profile_selected_upstream": false,
    "new_continuous_physical_parameters": 0,
    "new_discrete_physical_selectors": 0,
    "new_fitted_parameters": 0,
    "new_observed_inputs": 0,
    "normal_rank_selected_by_q79": 4,
    "remaining_structural_source_morphisms": 1
  },
  "physical_boundary": {
    "B_ACTION_01_closed": false,
    "B_QFT_02_closed": false,
    "Lorentzian_domain_and_statistics_emitted": false,
    "T34_radial_line_equals_q79_RanP_parallel_line": false,
    "actual_operator_intertwiner_emitted": false,
    "actual_physical_q79_normal_block_emitted": false,
    "constructed_root_is_selected_upstream_root": false,
    "finite_model_source_root_is_internally_single": true,
    "next_operator_equation": "(1/2) log det(K_phys(h) K_phys(H)^-1)=rho(h/H)",
    "physical_G0_closed": false,
    "physical_G1_closed": false,
    "physical_G2_closed": false,
    "physical_density_and_BV_cycle_emitted": false,
    "scalar_determinant_equation_is_sufficient_for_operator_equivalence": false,
    "selected_interacting_state_emitted": false
  },
  "pointed_intertwiner": {
    "action_pushforward_closed_in_model": true,
    "fixed_point_square_closed_in_model": true,
    "lower_action_zero_jet_relative": "0",
    "lower_effective_hessian": "kappa",
    "lower_effective_tadpole": "0",
    "lower_fixed_point": "h=H",
    "nonlinear_quantum_vertices_retained": true,
    "one_constructed_root_for_model": "997a8ffd4fc88b8079909061c54b691c0196e6275bc9920f75bf4b51e668bc61",
    "rho_zero_two_jet": true,
    "tangent_generator_square_closed_in_model": true,
    "upper_action_zero_jet_relative": "0",
    "upper_fixed_point": "w_* in M_H",
    "upper_radial_hessian": "kappa",
    "upper_radial_tadpole": "0"
  },
  "q79_carrier": {
    "J_DE": [
      [
        "0",
        "0",
        "0",
        "-1",
        "0",
        "0"
      ],
      [
        "0",
        "0",
        "0",
        "0",
        "-1",
        "0"
      ],
      [
        "0",
        "0",
        "0",
        "0",
        "0",
        "-1"
      ],
      [
        "1",
        "0",
        "0",
        "0",
        "0",
        "0"
      ],
      [
        "0",
        "1",
        "0",
        "0",
        "0",
        "0"
      ],
      [
        "0",
        "0",
        "1",
        "0",
        "0",
        "0"
      ]
    ],
    "J_matches_q79_source": true,
    "P": [
      [
        "1/3",
        "1/3",
        "1/3",
        "0",
        "0",
        "0"
      ],
      [
        "1/3",
        "1/3",
        "1/3",
        "0",
        "0",
        "0"
      ],
      [
        "1/3",
        "1/3",
        "1/3",
        "0",
        "0",
        "0"
      ],
      [
        "0",
        "0",
        "0",
        "1/3",
        "1/3",
        "1/3"
      ],
      [
        "0",
        "0",
        "0",
        "1/3",
        "1/3",
        "1/3"
      ],
      [
        "0",
        "0",
        "0",
        "1/3",
        "1/3",
        "1/3"
      ]
    ],
    "P_Q_orthogonal": true,
    "P_matches_q79_source": true,
    "P_plus_Q_is_identity": true,
    "Q": [
      [
        "2/3",
        "-1/3",
        "-1/3",
        "0",
        "0",
        "0"
      ],
      [
        "-1/3",
        "2/3",
        "-1/3",
        "0",
        "0",
        "0"
      ],
      [
        "-1/3",
        "-1/3",
        "2/3",
        "0",
        "0",
        "0"